Event Name,Event Time,Status,External Url
Crypto Valley Week - Davos,"Jan 20, 2020 09:00 AM - Jan 24, 2020 07:00 PM",RELINQUISHED,https://www.eventbrite.co.uk/o/cv-labs-27649393351
Startup Growth Networking Meetup in New York x WeWork 205 Hudson St,"Oct 31, 2019 08:00 PM - Oct 31, 2019 10:00 PM",RELINQUISHED,http://eChai.Network
Value of Bitcoin Digital 2020,"Jun 02, 2020 01:00 PM - Jun 03, 2020 08:00 PM",RELINQUISHED,https://vob-conference.com/
CEO Crossing Community Kickoff Event with Special Guest Mo Brossette,"Jul 15, 2020 06:00 PM - Jul 15, 2020 07:00 PM",RELINQUISHED,https://airmeet.com/e/b3bb5260-a92a-11ea-b4f9-2392f2ecf37e
Blockchain and Genomics Webinar (Closing Ticket Sales!),"Jul 24, 2020 04:00 PM - Jul 24, 2020 05:00 PM",RELINQUISHED,https://zoom.us/webinar/register/WN_Kguwj0UrQ32MQPxkGamGag
BC 2021 // www.blockchance.eu,"Jul 07, 2021 06:00 AM - Jul 09, 2021 09:00 PM",RELINQUISHED,https://universe.com/bc21
"Watch Coinscrum Markets Ep010 :: Mike Moro, Jeremy Allaire, Garrick Hileman","Jul 02, 2020 04:00 PM - Jul 09, 2020 01:00 PM",RELINQUISHED,
20 FREE Amazing Offers! MoneyWiseAlpha.com Affiliate Business Launch Promo!,"Feb 21, 2020 02:00 AM - Mar 20, 2020 04:00 PM",RELINQUISHED,https://www.moneywisealpha.com/free/
Reshaping the World of Electronics,"Dec 13, 2022 05:00 PM - Dec 13, 2022 05:30 PM",RELINQUISHED,https://audience.mysequire.com/webinar-view?webinar_id=902f71cb-6874-48d8-83a3-02f18220ccae
How to win more high paying clients in 2023 ✨✨ Free Masterclass,"Jan 25, 2023 02:00 PM - Jan 25, 2023 03:00 PM",RELINQUISHED,
The Curious Mind's State of AI,"Oct 25, 2024 07:00 PM - Oct 25, 2024 08:00 PM",RELINQUISHED,https://us06web.zoom.us/j/3392341657
LinkedIn Lead Generation Strategies & System to 2-10X Your Sales in 2024,"Mar 19, 2024 04:00 PM - Mar 19, 2024 05:00 PM",RELINQUISHED,https://imaginegrowthinstitute.com/masterclass?utm_campaign=e34&utm_source=li&utm_medium=social
How to stop being so emotionally reactive and make even sharper decisions,"Nov 14, 2022 11:00 PM - Nov 15, 2022 12:00 AM",RELINQUISHED,https://us02web.zoom.us/meeting/register/tZwvcu-rqDsuG9IPa7Yx5GV6GIaTkgiGzw82
Watch Now :: Coinscrum /Markets :: Ep 006 :: Tim Draper & Grayscale,"Jun 04, 2020 04:00 PM - Jun 08, 2020 04:00 PM",RELINQUISHED,
Coinscrum /Markets :: Ep.004,"May 21, 2020 04:00 PM - May 21, 2020 04:45 PM",RELINQUISHED,
Next Top Metaverse Build for Aftermath Islands presented by Renovi,"Dec 01, 2022 05:00 PM - Dec 01, 2022 05:30 PM",RELINQUISHED,
"Watch Now :Coinscrum /Markets Ep009 :: Featuring Binance CEO, CZ","Jun 25, 2020 04:00 PM - Jul 02, 2020 03:00 PM",RELINQUISHED,
Unicorn Battle in California,"Jul 14, 2020 05:00 PM - Jul 14, 2020 07:30 PM",RELINQUISHED,https://www.eventbrite.com/e/unicorn-battle-in-california-tickets-94500001047
CALLING ALL STARTUPS,"Aug 21, 2020 02:00 PM - Aug 22, 2020 10:00 PM",RELINQUISHED,https://synapsisevents.com/
"Coinscrum Markets Ep013: Feat. Greg Kidd, Copper, ITI Digital, Chainalysis","Jul 23, 2020 04:00 PM - Jul 30, 2020 03:00 PM",RELINQUISHED,
How To Turn LinkedIn Into A Lead (And Sales) Generating Machine!,"Nov 30, 2022 07:00 PM - Nov 30, 2022 08:00 PM",RELINQUISHED,
"China's Angle, Tech for Global","May 31, 2020 02:30 AM - May 31, 2020 03:30 AM",RELINQUISHED,https://www.eventbrite.com/e/chinas-angle-tech-for-global-tickets-106639904826?utm_source=eventbrite&utm_medium=email&utm_campaign=post_publish&utm_content=EBLinkEvent&utm_term=shortLinkViewMyEvent
"Watch Coinscrum Markets Ep014 : w/ Nic Carter, BitOoda, FlowDesk & ByteTree","Jul 30, 2020 04:00 PM - Aug 06, 2020 03:00 PM",RELINQUISHED,
2023 January ❅ Crypto VC Pitching Session: WEB3 MIXED by InnMind,"Jan 25, 2023 04:00 PM - Jan 25, 2023 05:00 PM",RELINQUISHED,
ROAD TO SUSTAINABILITY,"Jul 29, 2020 04:00 PM - Jul 29, 2020 05:00 PM",RELINQUISHED,
NYC Turkish Professionals Meetup,"Feb 28, 2020 12:00 AM - Feb 28, 2020 03:00 AM",RELINQUISHED,https://www.eventbrite.com/e/nyc-turkish-professionals-meetup-tickets-96178457355
Online Unicorn Battle in Boston,"Jul 07, 2020 03:00 PM - Jul 07, 2020 05:03 PM",RELINQUISHED,https://www.eventbrite.com/e/online-unicorn-battle-in-boston-tickets-93681406609
BizzMatcher Online Show (Start-ups meet Investors via Zoom event),"Jul 04, 2020 04:00 PM - Jul 04, 2020 06:00 PM",RELINQUISHED,https://www.signature-network.com/bizzmatcher-online-show/
Freelancing Side Business Launch Promotion,"Jan 25, 2020 04:00 AM - Jan 31, 2020 04:00 PM",RELINQUISHED,http://bit.ly/MWAGigs
BizzMatcher Investment Show Volume2 (Startups Meet Investors on Zoom),"Aug 10, 2020 11:00 AM - Aug 10, 2020 02:00 PM",RELINQUISHED,https://bizzmatcher-invest.com/step-2
"Webcast - Evolution, Not Revolution: Investing in Digitization & Blockchain","Aug 12, 2020 05:00 PM - Aug 12, 2020 06:00 PM",RELINQUISHED,https://us02web.zoom.us/webinar/register/3815870059731/WN_rcuWP0oqRRmyKZ_v1YAl6A
Startup Growth Networking Meetup in New York x WeWork 205 Hudson St,"Oct 03, 2019 08:00 PM - Oct 03, 2019 10:00 PM",RELINQUISHED,https://www.eventbrite.com/e/startup-growth-networking-meetup-in-new-york-x-wework-205-hudson-st-tickets-73727497931
Unlock the power of your documents with this super secret tool!,"Dec 15, 2022 10:30 AM - Dec 15, 2022 11:00 AM",RELINQUISHED,https://meet.google.com/aan-ccbo-syb
"Watch now : Coinscrum /Markets Ep008 :: Saifedean, Fidelity, Kraken, Protos","Jun 18, 2020 04:00 PM - Jun 25, 2020 04:00 PM",RELINQUISHED,
Value of Bitcoin Digital - The Halvening,"May 11, 2020 02:00 PM - May 12, 2020 09:00 PM",RELINQUISHED,https://vob-conference.com/agenda/
IstanBlock 2020,"Apr 09, 2020 09:00 AM - Apr 10, 2020 11:00 PM",RELINQUISHED,https://www.eventbrite.com/e/istanblock2020-tickets-86112718459
Startup World Cup New York Conference,"Dec 06, 2019 04:00 PM - Dec 06, 2019 10:00 PM",RELINQUISHED,https://swcny2019.eventbrite.com/?aff=linkedin
Will the New Financial System Help You or Hurt You? ,"Dec 05, 2022 04:30 PM - Dec 05, 2022 05:30 PM",RELINQUISHED,https://us02web.zoom.us/j/8316855978?pwd=Qjc4RG16cVpXTXBoMnY5NWV6YllwZz09
Cryptocurrency Regulatory Sandbox Framework in India,"Jul 30, 2020 01:30 PM - Oct 02, 2020 09:30 AM",RELINQUISHED,https://www.buyucoin.com/sandbox
Requisite Agility Exploring New Realities,"Jun 18, 2020 11:00 AM - Jul 07, 2020 04:00 PM",RELINQUISHED,https://requisiteagility.org/attend/exploring-new-realities#section-id-1551778693135
BlockDown 2.0 - The No.1 3D Virtual BlockChain Conference,"Jun 18, 2020 07:00 AM - Jun 19, 2020 07:00 AM",RELINQUISHED,https://www.eventbrite.com/e/blockdown-20-tickets-103251219176
Dark Web Deep Dive: Forum Ecosystems,"Jul 30, 2024 03:00 PM - Jul 30, 2024 04:00 PM",RELINQUISHED,https://streamyard.com/watch/mJbNmnKwF3gb
